{
  "base_phase_c_v1": {
    "artifact": {
      "byte_length": 122965,
      "path": "reference/phase-c/v1/report.json",
      "sha256": "88efd33d0f9d947ad0926e8d468549a529dcb811c4bfa99e93da95a0cdb47908"
    },
    "authenticated_input_count": 96,
    "candidate_case_count": 290,
    "contract_id": "qwen-mm-compat-v1",
    "passed": true,
    "schema_id": "qwen-mm-phase-c-conformance-report-v1",
    "skipped_case_count": 0,
    "source_fingerprint": "071d371a37b6762b981ab589584c13a033d5afbe11c6f72f0568b5b2d82be76d",
    "tested_revision": "b7d8eee2eb4096ed966e6fc8740919ae312eb3a5"
  },
  "contract_id": "qwen-mm-still-image-resize-v2",
  "created_at": "2026-08-26T15:37:20.555125+00:00",
  "current_candidate": {
    "allowed_production_delta": [
      "Cargo.lock",
      "Cargo.toml",
      "crates/qwen-mm-core/Cargo.toml",
      "crates/qwen-mm-core/examples/resize_quality_v2_candidates.rs",
      "crates/qwen-mm-core/examples/still_resize_bakeoff.rs",
      "crates/qwen-mm-core/src/media_conformance_tests.rs",
      "crates/qwen-mm-core/src/observability.rs",
      "crates/qwen-mm-core/src/patchify.rs",
      "crates/qwen-mm-core/src/resize.rs"
    ],
    "backend_source": {
      "byte_length": 63067,
      "path": "crates/qwen-mm-core/src/resize.rs",
      "sha256": "bb92af79e16d45234f50ba1bbd465e72504ddc2c71aead8bc037727c79fc09c2"
    },
    "capture": {
      "candidate_environment": {
        "abi_tag": "cpython-311",
        "implementation": "CPython",
        "installed_origin": true,
        "native_origin": "lib/python3.11/site-packages/qwen_mm/_native.abi3.so",
        "numpy": "2.4.6",
        "package_origin": "lib/python3.11/site-packages/qwen_mm/__init__.py",
        "platform": "macOS-26.5.2-arm64-arm-64bit",
        "python": "3.11.15"
      },
      "case_count": 45,
      "direct_core_case_ids": [
        "ramp-horizontal-down",
        "ramp-vertical-up"
      ],
      "installed_wheel_evidence": {
        "candidate_case": {
          "byte_length": 39627,
          "path": "outputs/installed-wheel-arm64/case.json",
          "sha256": "d3be79f5b6af8d0c0c5f6132f2a21d22fd4cc11319626f4f25836fccd4c852b7"
        },
        "candidate_result": {
          "byte_length": 138342,
          "path": "outputs/installed-wheel-arm64/actual/result.json",
          "sha256": "c783e6e077f5cb2b655c6612ca624f8a2fcc8c658a18837f0a9b738b76184ccd"
        },
        "image_grid_thw": {
          "byte_length": 1160,
          "path": "outputs/installed-wheel-arm64/actual/arrays/image_grid_thw.npy",
          "sha256": "55a6a4caf869db3c36e99cd6f1bcea5ea67ff06e06d718bfb9ea8a79a51508a7"
        },
        "mode": "architecture-local-installed-wheel-v1",
        "pixel_values": {
          "byte_length": 22831232,
          "path": "outputs/installed-wheel-arm64/actual/arrays/pixel_values.npy",
          "sha256": "23782ccd0b0b0ef6a46b51a62fbfced90240bf3bda74a80e83f802e4c1d08ed2"
        },
        "rgb8": {
          "byte_length": 2914752,
          "path": "outputs/installed-wheel-resize.rgb8.bin",
          "sha256": "f4ea0c36e3a65000576e38b772080a69dbe3bd664e428137aa99846a96d32e6a"
        }
      },
      "isolation": {
        "forbidden_imports": [],
        "installed_origin": true,
        "native_path": "/private/tmp/qwen-mm-725c-overlay.Ym33oV/venv/lib/python3.11/site-packages/qwen_mm/_native.abi3.so",
        "oracle_accesses": [],
        "package_path": "/private/tmp/qwen-mm-725c-overlay.Ym33oV/venv/lib/python3.11/site-packages/qwen_mm/__init__.py",
        "sys_prefix": "/private/tmp/qwen-mm-725c-overlay.Ym33oV/venv"
      },
      "profile": "qwen3-vl-8b",
      "public_processor_case_count": 43,
      "public_processor_case_ids": [
        "noop-padded-ramp",
        "solid-black-up",
        "solid-white-down",
        "solid-midgray-anisotropic",
        "solid-red-up",
        "solid-green-down",
        "solid-blue-one-axis",
        "ramp-independent-anisotropic",
        "impulse-up",
        "impulse-down",
        "edge-vertical-down",
        "edge-horizontal-up",
        "checkerboard-up",
        "checkerboard-down",
        "nyquist-vertical-stripes",
        "nyquist-horizontal-stripes",
        "independent-rgb-down",
        "alternating-channels-up",
        "red-only-edge",
        "green-only-ramp",
        "blue-only-noise",
        "identical-channels-down",
        "channel-permutation-base",
        "channel-permutation-bgr",
        "noise-up",
        "noise-down",
        "factor-below",
        "factor-at",
        "factor-above",
        "min-below",
        "min-at",
        "min-above",
        "max-below",
        "max-at",
        "max-above",
        "procedural-fixture-crop-00-down",
        "procedural-fixture-crop-07-up",
        "procedural-fixture-crop-13-portrait",
        "procedural-fixture-crop-21-one-axis",
        "natural-blue-marble-africa-down",
        "natural-blue-marble-americas-portrait",
        "natural-blue-marble-asia-up",
        "natural-blue-marble-ocean-anisotropic"
      ],
      "public_processor_matches_installed_wheel_evidence": true,
      "quality_result": {
        "candidate": {
          "byte_length": 2914752,
          "path": "outputs/installed-wheel-resize.rgb8.bin",
          "sha256": "f4ea0c36e3a65000576e38b772080a69dbe3bd664e428137aa99846a96d32e6a"
        },
        "cases": [
          {
            "channels": [
              {
                "absolute_error_p50": 0.0,
                "absolute_error_p90": 0.0,
                "absolute_error_p99": 0.0,
                "absolute_signed_mean_bias": 0.0,
                "channel": "R",
                "gates": {
                  "absolute_error_p99": true,
                  "absolute_signed_mean_bias": true,
                  "maximum_absolute_error": true,
                  "rmse": true,
                  "ssim": true
                },
                "mae": 0.0,
                "maximum_absolute_error": 0.0,
                "passed": true,
                "psnr": "Infinity",
                "rmse": 0.0,
                "signed_mean_bias": 0.0,
                "ssim": 1.0
              },
              {
                "absolute_error_p50": 0.0,
                "absolute_error_p90": 0.0,
                "absolute_error_p99": 0.0,
                "absolute_signed_mean_bias": 0.0,
                "channel": "G",
                "gates": {
                  "absolute_error_p99": true,
                  "absolute_signed_mean_bias": true,
                  "maximum_absolute_error": true,
                  "rmse": true,
                  "ssim": true
                },
                "mae": 0.0,
                "maximum_absolute_error": 0.0,
                "passed": true,
                "psnr": "Infinity",
                "rmse": 0.0,
                "signed_mean_bias": 0.0,
                "ssim": 1.0
              },
              {
                "absolute_error_p50": 0.0,
                "absolute_error_p90": 0.0,
                "absolute_error_p99": 0.0,
                "absolute_signed_mean_bias": 0.0,
                "channel": "B",
                "gates": {
                  "absolute_error_p99": true,
                  "absolute_signed_mean_bias": true,
                  "maximum_absolute_error": true,
                  "rmse": true,
                  "ssim": true
                },
                "mae": 0.0,
                "maximum_absolute_error": 0.0,
                "passed": true,
                "psnr": "Infinity",
                "rmse": 0.0,
                "signed_mean_bias": 0.0,
                "ssim": 1.0
              }
            ],
            "exact_invariants": {
              "no_op_source_bytes": true
            },
            "id": "noop-padded-ramp",
            "passed": true
          },
          {
            "channels": [
              {
                "absolute_error_p50": 0.0,
                "absolute_error_p90": 0.0,
                "absolute_error_p99": 0.0,
                "absolute_signed_mean_bias": 0.0,
                "channel": "R",
                "gates": {
                  "absolute_error_p99": true,
                  "absolute_signed_mean_bias": true,
                  "maximum_absolute_error": true,
                  "rmse": true,
                  "ssim": true
                },
                "mae": 0.0,
                "maximum_absolute_error": 0.0,
                "passed": true,
                "psnr": "Infinity",
                "rmse": 0.0,
                "signed_mean_bias": 0.0,
                "ssim": 1.0
              },
              {
                "absolute_error_p50": 0.0,
                "absolute_error_p90": 0.0,
                "absolute_error_p99": 0.0,
                "absolute_signed_mean_bias": 0.0,
                "channel": "G",
                "gates": {
                  "absolute_error_p99": true,
                  "absolute_signed_mean_bias": true,
                  "maximum_absolute_error": true,
                  "rmse": true,
                  "ssim": true
                },
                "mae": 0.0,
                "maximum_absolute_error": 0.0,
                "passed": true,
                "psnr": "Infinity",
                "rmse": 0.0,
                "signed_mean_bias": 0.0,
                "ssim": 1.0
              },
              {
                "absolute_error_p50": 0.0,
                "absolute_error_p90": 0.0,
                "absolute_error_p99": 0.0,
                "absolute_signed_mean_bias": 0.0,
                "channel": "B",
                "gates": {
                  "absolute_error_p99": true,
                  "absolute_signed_mean_bias": true,
                  "maximum_absolute_error": true,
                  "rmse": true,
                  "ssim": true
                },
                "mae": 0.0,
                "maximum_absolute_error": 0.0,
                "passed": true,
                "psnr": "Infinity",
                "rmse": 0.0,